,brandnm,goodsnm,USER,reg_date,order_date,p_type,sub_type,app_yn,days,day_type,month,How_long
699,Prada,tweed texture chain bag,a1145528,2021-02-05,2021-02-07,7days,BA,Y,일요일,휴일,02,2
700,DKNY,knit flare long dress,a1143905,2021-01-20,2021-02-07,4days,D,Y,일요일,휴일,02,18
701,Dolce & Gabbana,pocket check pattern singlebreasted-coat,a1143905,2021-01-20,2021-02-07,4days,O,Y,일요일,휴일,02,18
702,Coach,surrey carryall bag brown,a1143905,2021-01-20,2021-02-07,4days,BA,Y,일요일,휴일,02,18
703,Overdueflair,pleats basic pattern pleats-skirt grey,a1139100,2020-12-22,2021-02-06,4days,B,Y,토요일,휴일,02,46
704,Yves Saint Laurent,kate small monogram bag beige,a1145459,2021-02-04,2021-02-06,4days,BA,Y,토요일,휴일,02,2
705,Olive des Olive,ruffle tweed pattern blouse pink,a1145488,2021-02-04,2021-02-06,7days,T,Y,토요일,휴일,02,2
706,Gucci,vintage web shoulder bag black,a1145410,2021-02-03,2021-02-06,7days,BA,Y,토요일,휴일,02,3
707,Fendi,3jours two way bag beige,a1145641,2021-02-06,2021-02-06,4days,BA,Y,토요일,휴일,02,0
708,Saint Laurent,chevron quilted cross bag green,a1145612,2021-02-06,2021-02-06,4days,BA,Y,토요일,휴일,02,0
709,Gucci,padlock GG canvas shoulder bag,a1145515,2021-02-04,2021-02-05,4days,BA,Y,금요일,주중,02,1
710,Sorry Too Much Love,button basic pattern A-Line dress cream,a116095,2019-02-18,2021-02-05,7days,D,Y,금요일,주중,02,718
711,Max Mara,button color block pattern coat black,a1101514,2020-05-25,2021-02-05,4days,O,Y,금요일,주중,02,256
712,Dewl,button basic pattern A-Line dress beige,a116095,2019-02-18,2021-02-05,7days,D,Y,금요일,주중,02,718
713,Gucci,dionysus cross bag beige,a1145559,2021-02-05,2021-02-05,4days,BA,Y,금요일,주중,02,0
714,Burberry,button check pattern dress brown,a1125807,2020-10-21,2021-02-05,4days,D,Y,금요일,주중,02,107
715,Chanel,grand-shopping caviar cream,a1145380,2021-02-03,2021-02-05,7days,BA,Y,금요일,주중,02,2
716,Gucci,dionysus shoulder bag beige,a1145471,2021-02-04,2021-02-05,7days,BA,Y,금요일,주중,02,1
717,Yves Saint Laurent,chevron quilting cross bag black,a1145218,2021-02-02,2021-02-05,7days,BA,Y,금요일,주중,02,3
718,Thom Browne,basic pattern skirt grey,a1129550,2020-11-09,2021-02-05,4days,B,Y,금요일,주중,02,88
719,Thom Browne,button basic pattern t-shirts white,a1129550,2020-11-09,2021-02-05,4days,T,Y,금요일,주중,02,88
720,Balmain,quilting detail denim skirt,a1129550,2020-11-09,2021-02-05,4days,B,Y,금요일,주중,02,88
721,Off White,black point check shirt_1,a1129550,2020-11-09,2021-02-05,4days,T,Y,금요일,주중,02,88
722,Balmain,basic pattern sweat-shirts white,a1129550,2020-11-09,2021-02-05,4days,T,Y,금요일,주중,02,88
723,Burberry,embroidery basic pattern sweater ivory,a1129550,2020-11-09,2021-02-05,4days,T,Y,금요일,주중,02,88
724,Gucci,mamont chain mini cross bag black,a189598,2020-03-22,2021-02-05,7days,BA,Y,금요일,주중,02,320
725,Marc New York,fur collar padding jumper black,a183676,2020-02-19,2021-02-05,4days,O,Y,금요일,주중,02,352
726,Marni,trunk mini saffiano bag black,a183676,2020-02-19,2021-02-05,4days,BA,Y,금요일,주중,02,352
727,Aspesi,high neck padding jumper black,a183676,2020-02-19,2021-02-05,4days,O,Y,금요일,주중,02,352
728,VOV,check pattern hood wrap coat,a1145533,2021-02-05,2021-02-05,4days,O,Y,금요일,주중,02,0
729,Time homme,button basic pattern doublebreasted-coat brown,a1145531,2021-02-05,2021-02-05,4days,O,Y,금요일,주중,02,0
730,Gucci,vintage web GG two way bag brown,a1145531,2021-02-05,2021-02-05,4days,BA,Y,금요일,주중,02,0
731,Thom Browne,graphics pattern sweat-shirts grey,a1126933,2020-10-27,2021-02-05,7days,T,Y,금요일,주중,02,101
732,Maje,check pattern A-Line dress,a1145518,2021-02-04,2021-02-05,7days,D,Y,금요일,주중,02,1
733,Ralph Lauren,strap basic pattern wrap-coat black,a1145485,2021-02-04,2021-02-05,4days,O,Y,금요일,주중,02,1
734,Vivienne Westwood,button basic pattern A-Line dress charcoal,a1145163,2021-02-02,2021-02-05,7days,D,Y,금요일,주중,02,3
735,Max Mara,draping detail raglan sleeve dress,a1145162,2021-02-02,2021-02-05,4days,D,Y,금요일,주중,02,3
736,Molliolli,button basic pattern fur-outer beige,a1145498,2021-02-04,2021-02-04,7days,O,N,목요일,주중,02,0
737,Sandro,dots pattern H-Line dress deeppink,a1144299,2021-01-24,2021-02-04,4days,D,Y,목요일,주중,02,11
738,Gucci,mammont chain wallet bag black,a1144976,2021-01-30,2021-02-04,4days,BA,Y,목요일,주중,02,5
739,Carven,round collar raglan sleeve coat,a1144976,2021-01-30,2021-02-04,4days,O,Y,목요일,주중,02,5
740,Fendi,runaway regular bag,a1145187,2021-02-02,2021-02-04,7days,BA,Y,목요일,주중,02,2
741,Chanel,classic clutch black,a1145073,2021-02-01,2021-02-04,4days,BA,Y,목요일,주중,02,3
742,Chanel,classic clutch black,a1145436,2021-02-04,2021-02-04,7days,BA,Y,목요일,주중,02,0
743,Saint Laurent,chevron quilted bag black,a1145479,2021-02-04,2021-02-04,4days,BA,N,목요일,주중,02,0
744,Max Mara,string belted padding jumper pink,a1102098,2020-05-29,2021-02-04,4days,O,Y,목요일,주중,02,251
745,Chanel,zipper detail bucket tote bag,a1102098,2020-05-29,2021-02-04,4days,BA,Y,목요일,주중,02,251
746,Gucci,marmont gg logo quilted bag Black,a1143565,2021-01-17,2021-02-04,4days,BA,Y,목요일,주중,02,18
747,thom browne,zipper clutch black,a1145467,2021-02-04,2021-02-04,4days,BA,N,목요일,주중,02,0
748,Saint Laurent,chevron quilting cross bag cream,a1145230,2021-02-02,2021-02-04,4days,BA,N,목요일,주중,02,2
749,Valentino,rockstud cross bag orange,a113690,2018-12-29,2021-02-04,4days,BA,Y,목요일,주중,02,768
750,Chanel,boy chanel clutch black,a1145135,2021-02-01,2021-02-04,7days,BA,Y,목요일,주중,02,3
751,Gucci,marmont GG logo quilted bag black,a1145346,2021-02-03,2021-02-04,7days,BA,N,목요일,주중,02,1
752,Ralph Lauren,button basic pattern shirts white,a1139551,2020-12-23,2021-02-04,4days,T,Y,목요일,주중,02,43
753,Gucci,flap cross bag grey,a1144947,2021-01-30,2021-02-04,4days,BA,Y,목요일,주중,02,5
754,Thom Browne,button basic pattern jacket grey,a1145427,2021-02-04,2021-02-04,4days,O,Y,목요일,주중,02,0
755,Saint Laurent,chevron quilted cross bag black,a1145337,2021-02-03,2021-02-04,4days,BA,N,목요일,주중,02,1
756,Gucci,logo pointed cross bag,a1145417,2021-02-04,2021-02-04,7days,BA,N,목요일,주중,02,0
757,Chanel,boy chanel clutch black,a1145406,2021-02-03,2021-02-04,7days,BA,Y,목요일,주중,02,1
758,Rouje,flower pattern blouse burgundy,a119446,2019-04-05,2021-02-04,4days,T,Y,목요일,주중,02,671
759,Louis Vuitton,damier eben tote bag,a1145137,2021-02-01,2021-02-04,7days,BA,Y,목요일,주중,02,3
760,It michaa,button basic pattern coat red,a144328,2019-09-30,2021-02-04,4days,O,Y,목요일,주중,02,493
761,Mixed,[66]El estilo de Claire - wang letter neoprene top_pleats leather style skirt black,a1139388,2020-12-23,2021-02-04,4days,TP,Y,목요일,주중,02,43
762,Mixed,embroidery twist knit & mini gored skirt,a1139388,2020-12-23,2021-02-04,4days,TP,Y,목요일,주중,02,43
763,Miu Miu,zig zag pattern cardigan multi,a1139388,2020-12-23,2021-02-04,4days,O,Y,목요일,주중,02,43
764,Christian Dior,pleats basic pattern wool pleats-skirt brown,a1139388,2020-12-23,2021-02-04,4days,B,Y,목요일,주중,02,43
765,Prada,daino crossbody bag black 2,a1145353,2021-02-03,2021-02-04,4days,BA,Y,목요일,주중,02,1
766,Prada,saffiano cross chain bag black,a1145165,2021-02-02,2021-02-04,7days,BA,Y,목요일,주중,02,2
767,El estilo de Claire,roll-up detail jumpsuit khaki,a1145130,2021-02-01,2021-02-04,4days,D,Y,목요일,주중,02,3
768,Dior,oblique canvas half moon bag,a1145130,2021-02-01,2021-02-04,4days,BA,Y,목요일,주중,02,3
769,Yves Saint Laurent,collège medium cross bag,a1145238,2021-02-02,2021-02-03,7days,BA,Y,수요일,주중,02,1
770,Gucci,dionysus shoulder bag beige,a1117773,2020-09-03,2021-02-03,4days,BA,N,수요일,주중,02,153
771,BYREDO,discover the stencil embellishment,a1145263,2021-02-02,2021-02-03,7days,BA,Y,수요일,주중,02,1
772,Miu Miu,matelasse shoulder bag black,a1145170,2021-02-02,2021-02-03,7days,BA,Y,수요일,주중,02,1
773,Gucci,GG clutch chain bag,a1145046,2021-01-31,2021-02-03,7days,BA,Y,수요일,주중,02,3
774,Alexander Mcqueen,belted short jacket cream 1,a1145279,2021-02-03,2021-02-03,4days,O,Y,수요일,주중,02,0
775,Prada,round neck cardigan beige,a1145279,2021-02-03,2021-02-03,4days,T,Y,수요일,주중,02,0
776,Prada,color strap shoulder bag navy,a1145279,2021-02-03,2021-02-03,4days,BA,Y,수요일,주중,02,0
777,Banana Republic,button stripe pattern sweater mustard,a1145335,2021-02-03,2021-02-03,4days,T,Y,수요일,주중,02,0
778,Prada,check pattern lined vest,a1110447,2020-08-05,2021-02-03,4days,T,Y,수요일,주중,02,182
779,Sandro,flower pattern v-neck long dress,a180457,2020-02-06,2021-02-03,4days,D,Y,수요일,주중,02,363
780,Gucci,ribbon basic pattern jacket pink,a1145200,2021-02-02,2021-02-03,4days,O,Y,수요일,주중,02,1
781,Chanel,quilted shoulder bag black,a1145327,2021-02-03,2021-02-03,4days,BA,Y,수요일,주중,02,0
782,Chanel,boy chanel crossbody bag black,a1145060,2021-01-31,2021-02-03,4days,BA,Y,수요일,주중,02,3
783,Chanel,classic logo chain shoulder bag white,a1110831,2020-08-09,2021-02-03,4days,BA,Y,수요일,주중,02,178
784,Yves Saint Laurent,kate small monogram bag black,a1145296,2021-02-03,2021-02-03,7days,BA,Y,수요일,주중,02,0
785,Prada,medium Nylon Backpack black,a1135783,2020-12-07,2021-02-03,4days,BA,Y,수요일,주중,02,58
786,Gucci,sylvie leather mini chain bag black,a1145175,2021-02-02,2021-02-03,7days,BA,Y,수요일,주중,02,1
787,El estilo de Claire,button basic pattern doublebreasted-coat black,a1145175,2021-02-02,2021-02-03,4days,O,Y,수요일,주중,02,1
788,Vivienne Westwood,basic pattern H-Line wool dress black,a1145175,2021-02-02,2021-02-03,7days,D,Y,수요일,주중,02,1
789,Saint Laurent,button basic pattern shirts blue,a1139101,2020-12-22,2021-02-03,4days,T,Y,수요일,주중,02,43
790,Gucci,dionysus cross bag black,a1144971,2021-01-30,2021-02-02,7days,BA,Y,화요일,주중,02,3
791,Isabel Marant,big double button coat gray,a150969,2019-10-25,2021-02-02,4days,O,Y,화요일,주중,02,466
792,Dolce & Gabbana,pleats detail tweed dress multi,a150969,2019-10-25,2021-02-02,4days,D,Y,화요일,주중,02,466
793,Gucci,vintage web round cross bag black,a1145249,2021-02-02,2021-02-02,4days,BA,Y,화요일,주중,02,0
794,Vivienne Westwood,nappa clasp chain bag,a1144940,2021-01-30,2021-02-02,7days,BA,Y,화요일,주중,02,3
795,Christian Dior,classic two way bag pink,a1143720,2021-01-18,2021-02-02,7days,BA,Y,화요일,주중,02,15
796,Michaa,check pattern H-Line dress,a1145226,2021-02-02,2021-02-02,4days,D,N,화요일,주중,02,0
797,Burberry,vintage check and leather cross bag black,a1144705,2021-01-27,2021-02-02,7days,BA,Y,화요일,주중,02,6
798,SJSJ,center embroidery dress ivory,a1145224,2021-02-02,2021-02-02,4days,D,Y,화요일,주중,02,0
799,Imvely,ribbon flower pattern A-Line dress multi,a1145224,2021-02-02,2021-02-02,4days,D,Y,화요일,주중,02,0
800,Self-portrait,lace flower pattern peplum-dress,a1145217,2021-02-02,2021-02-02,4days,D,Y,화요일,주중,02,0
801,Louis Vuitton,monogram shoulder bag black,a1143575,2021-01-17,2021-02-02,7days,BA,Y,화요일,주중,02,16
802,Saint Laurent,chevron quilted cross bag black,a1145206,2021-02-02,2021-02-02,4days,BA,Y,화요일,주중,02,0
803,Prada,small logo bucket bag black,a1145039,2021-01-31,2021-02-02,7days,BA,Y,화요일,주중,02,2
804,Gucci,vintage web shoulder bag black,a1144530,2021-01-26,2021-02-02,4days,BA,N,화요일,주중,02,7
805,Yves Saint Laurent,chevron logo clutch bag black,a1144530,2021-01-26,2021-02-02,4days,BA,N,화요일,주중,02,7
806,Givenchy,ribbon basic pattern H-Line dress black,a1144530,2021-01-26,2021-02-02,4days,D,Y,화요일,주중,02,7
807,Louis Vuitton,verni clutch chain bag pink,a1145051,2021-01-31,2021-02-02,4days,BA,Y,화요일,주중,02,2
808,Gucci,marmont gg logo quilted bag Black,a1145191,2021-02-02,2021-02-02,4days,BA,Y,화요일,주중,02,0
809,Max Mara,single breasted long coat black,a1145191,2021-02-02,2021-02-02,4days,O,Y,화요일,주중,02,0
810,Louis Vuitton,monogram eva clutch,a1141254,2021-01-05,2021-02-02,4days,BA,Y,화요일,주중,02,28
811,Gucci,mamont chain bag red,a1140427,2020-12-29,2021-02-02,7days,BA,Y,화요일,주중,02,35
812,Gucci,lettering pattern sweater black,a1145176,2021-02-02,2021-02-02,7days,T,Y,화요일,주중,02,0
813,Gucci,lettering point two way bag brown,a143043,2019-09-26,2021-02-02,4days,BA,Y,화요일,주중,02,495
814,Stylenanda,leopard pattern frill long dress_,a1145144,2021-02-01,2021-02-02,4days,D,Y,화요일,주중,02,1
815,The Clozet,pocket point fur jumper black,a1145144,2021-02-01,2021-02-02,4days,O,Y,화요일,주중,02,1
816,Louis Vuitton,verni mini clutch chain bag brown,a1145144,2021-02-01,2021-02-02,4days,BA,Y,화요일,주중,02,1
817,Dewl,button basic pattern jacket black,a159684,2019-11-29,2021-02-02,7days,O,Y,화요일,주중,02,431
818,Bulgari,serpenti bag green,a159684,2019-11-29,2021-02-02,7days,BA,Y,화요일,주중,02,431
819,Gucci,quilted GG marmont clutch bag,a1145156,2021-02-01,2021-02-01,7days,BA,Y,월요일,주중,02,0
820,Gucci,padlock GG canvas chain bag 2,a1145123,2021-02-01,2021-02-01,4days,BA,Y,월요일,주중,02,0
821,Saint Laurent,quilted calfskin shoulder bag,a1144954,2021-01-30,2021-02-01,4days,BA,Y,월요일,주중,02,2
822,Ted Baker,color block pattern wool fur-outer,a139044,2019-09-07,2021-02-01,4days,O,Y,월요일,주중,02,513
823,Gucci,pattern pointed a-line skirts,a1135235,2020-12-04,2021-02-01,4days,B,Y,월요일,주중,02,59
824,Chloe,faye small bag black,a1144998,2021-01-31,2021-02-01,4days,BA,N,월요일,주중,02,1
825,Prada,button basic pattern coat black,a1144978,2021-01-31,2021-02-01,7days,O,Y,월요일,주중,02,1
826,Saint Laurent,mini sunset chain bag black,a1145011,2021-01-31,2021-02-01,7days,BA,Y,월요일,주중,02,1
827,Gucci,jackie 1961 hobo bag brown,a1145076,2021-02-01,2021-02-01,7days,BA,Y,월요일,주중,02,0
828,Burberry,button check pattern H-Line dress multi,a1151196,2021-03-28,2021-03-31,7days,D,N,수요일,주중,03,3
829,El estilo de Claire,frill stripe knit cardigan muti,a1151564,2021-03-31,2021-03-31,7days,T,N,수요일,주중,03,0
830,Chanel,tweed jacket brown,a1148120,2021-03-03,2021-03-31,4days,O,N,수요일,주중,03,28
831,Chloe,round handle tote bag black,a117466,2019-03-06,2021-03-31,4days,BA,Y,수요일,주중,03,756
832,Gucci,vintage web shoulder bag black,a110727,2018-10-27,2021-03-31,4days,BA,N,수요일,주중,03,886
833,McGinn,flower lace layered dress pink,a1151265,2021-03-29,2021-03-31,4days,D,Y,수요일,주중,03,2
834,Max Mara,classic mood check pattern jacket,a1151260,2021-03-29,2021-03-31,7days,O,Y,수요일,주중,03,2
835,Theory,belt basic pattern trench-coat black,a184442,2020-02-23,2021-03-31,4days,O,Y,수요일,주중,03,402
836,Louis Vuitton,monogram canvas clutch bag,a13741,2018-03-20,2021-03-31,4days,BA,Y,수요일,주중,03,1107
837,Lanvin Collection,gather basic pattern H-Line dress charcoal,a1150967,2021-03-26,2021-03-31,7days,D,Y,수요일,주중,03,5
838,Mine,basic pattern H-Line wool dress grey,a1150967,2021-03-26,2021-03-31,7days,D,Y,수요일,주중,03,5
839,Chanel,classic clutch black,a1151106,2021-03-28,2021-03-31,4days,BA,Y,수요일,주중,03,3
840,Gucci,flap cross bag black,a1151181,2021-03-28,2021-03-31,7days,BA,Y,수요일,주중,03,3
841,Fayewoo,gather check pattern H-Line dress multi,a1151136,2021-03-28,2021-03-31,7days,D,N,수요일,주중,03,3
842,Burberry,button basic pattern top black,a1150877,2021-03-26,2021-03-31,4days,T,Y,수요일,주중,03,5
843,Nain,long sleeve lace dress ivory,a1150759,2021-03-25,2021-03-31,4days,D,N,수요일,주중,03,6
844,Gucci,graphics pattern sweat-shirts ivory,a1151496,2021-03-31,2021-03-31,7days,T,Y,수요일,주중,03,0
845,Saint Laurent,chevron quilted cross bag black,a125904,2019-05-24,2021-03-31,4days,BA,Y,수요일,주중,03,677
846,Saint Laurent,sac de jour tote pink,a1151046,2021-03-27,2021-03-31,7days,BA,Y,수요일,주중,03,4
847,Louis Vuitton,Mogram neonoe bucket brown bag,a174354,2020-01-16,2021-03-31,4days,BA,Y,수요일,주중,03,440
848,Alexander Mcqueen,pocket basic pattern jacket charcoal,a1121652,2020-09-28,2021-03-31,4days,O,Y,수요일,주중,03,184
849,Lucky Chouette,button check pattern shirts multi,a157459,2019-11-21,2021-03-31,4days,T,Y,수요일,주중,03,496
850,Gucci,GG supreme clutch brown,a1151499,2021-03-31,2021-03-31,4days,BA,Y,수요일,주중,03,0
851,Michaa,gather basic pattern H-Line dress green,a1144560,2021-01-26,2021-03-31,4days,D,Y,수요일,주중,03,64
852,Nain,wrap detail coat beige,a1151465,2021-03-31,2021-03-31,7days,O,N,수요일,주중,03,0
853,Theory,pocket basic pattern skirt white,a1151481,2021-03-31,2021-03-31,4days,B,Y,수요일,주중,03,0
854,Burberry,button basic pattern wool cardigan grey,a1151479,2021-03-31,2021-03-31,4days,O,Y,수요일,주중,03,0
855,Prada,basic pattern padding-outer black,a1151457,2021-03-30,2021-03-31,4days,O,Y,수요일,주중,03,1
856,Louis Vuitton,verni mini clutch chain bag black,a1151301,2021-03-29,2021-03-31,4days,BA,Y,수요일,주중,03,2
857,Fendi,stripe pattern two way bucket bag brown,a1151466,2021-03-31,2021-03-31,7days,BA,Y,수요일,주중,03,0
858,Saint Laurent,monogram clutch black,a1148598,2021-03-08,2021-03-31,4days,BA,Y,수요일,주중,03,23
859,A.P.C.,half round chain bag black,a129477,2019-06-13,2021-03-31,4days,BA,Y,수요일,주중,03,657
860,Banana Republic,button basic pattern pants brown,a1151213,2021-03-29,2021-03-31,4days,B,Y,수요일,주중,03,2
861,Cos,pocket basic pattern jacket beige,a1151437,2021-03-30,2021-03-31,4days,O,Y,수요일,주중,03,1
862,Gucci,logo pointed cross bag black,a1117995,2020-09-05,2021-03-31,4days,BA,Y,수요일,주중,03,207
863,Yves Saint Laurent,chevron pattern chain bag beige,a1100548,2020-05-16,2021-03-31,4days,BA,Y,수요일,주중,03,319
864,On&On,slit basic pattern skirt black,a1100548,2020-05-16,2021-03-31,4days,B,Y,수요일,주중,03,319
865,Dolce & Gabbana,classic two way bag beige,a1151332,2021-03-29,2021-03-30,7days,BA,Y,화요일,주중,03,1
866,Thom Browne,basic pattern sweat-shirts grey,a1151404,2021-03-30,2021-03-30,4days,T,Y,화요일,주중,03,0
867,Gucci,GG marmont quilted-leather belt bag,a1151404,2021-03-30,2021-03-30,7days,BA,Y,화요일,주중,03,0
868,Fendi,diabolic eyes clutch bag,a1110169,2020-08-02,2021-03-30,4days,BA,Y,화요일,주중,03,240
869,& Other Stories,button basic pattern A-Line dress skyblue,a1110169,2020-08-02,2021-03-30,4days,D,Y,화요일,주중,03,240
870,Yves Saint Laurent,chevron quilting cross bag black,a1151433,2021-03-30,2021-03-30,4days,BA,N,화요일,주중,03,0
871,Dolce & Gabbana,lace long sleeve dress green,a1117957,2020-09-05,2021-03-30,4days,D,N,화요일,주중,03,206
872,Gucci,brooch check pattern H-Line dress ivory,a1117957,2020-09-05,2021-03-30,4days,D,N,화요일,주중,03,206
873,Saint Laurent,leather tassel cross body bag gray,a1151413,2021-03-30,2021-03-30,4days,BA,Y,화요일,주중,03,0
874,Givenchy,antigona S black 2,a1151117,2021-03-28,2021-03-30,7days,BA,Y,화요일,주중,03,2
875,Mixed,ribbon flower pattern blouse black & pleats flower pattern pleats-skirt black,a1149885,2021-03-18,2021-03-30,4days,TP,Y,화요일,주중,03,12
876,Imvely,ruffle flower pattern A-Line dress,a1151410,2021-03-30,2021-03-30,4days,D,Y,화요일,주중,03,0
877,Since then,gather flower pattern A-Line dress burgundy,a1151410,2021-03-30,2021-03-30,4days,D,Y,화요일,주중,03,0
878,& Other Stories,ribbon flower pattern A-Line dress multi,a1151410,2021-03-30,2021-03-30,4days,D,Y,화요일,주중,03,0
879,Comme des Garcons,heart logo pointed stripe shirts blue,a1142323,2021-01-11,2021-03-30,4days,T,Y,화요일,주중,03,78
880,Christian Dior,lucky badges handle bag black,a1151362,2021-03-30,2021-03-30,4days,BA,Y,화요일,주중,03,0
881,Reneevon,flare line lace dress pink,a1151131,2021-03-28,2021-03-30,4days,D,N,화요일,주중,03,2
882,Dolce & Gabbana,feminine mood flower shirring dress,a1144481,2021-01-25,2021-03-30,4days,D,Y,화요일,주중,03,64
883,Thom Browne,button stripe pattern shirts white,a1144481,2021-01-25,2021-03-30,4days,T,Y,화요일,주중,03,64
884,Louis Vuitton,Pochette trunk vertical black bag,a1151051,2021-03-27,2021-03-30,4days,BA,Y,화요일,주중,03,3
885,Chanel,Tote beige bag,a1136536,2020-12-11,2021-03-30,7days,BA,Y,화요일,주중,03,109
886,Louis Vuitton,monogram milla pochette MM,a1151153,2021-03-28,2021-03-30,4days,BA,Y,화요일,주중,03,2
887,Studio Tomboy,button basic pattern singlebreasted-jacket khaki,a1151309,2021-03-29,2021-03-29,4days,O,Y,월요일,주중,03,0
888,Mixed,color lace blouse & color lace skirt,a110947,2018-11-01,2021-03-29,7days,TP,Y,월요일,주중,03,879
889,Maje,pocket basic pattern jump-suit brown,a1151307,2021-03-29,2021-03-29,7days,D,Y,월요일,주중,03,0
890,Gucci,sylvie leather mini chain bag red,a144279,2019-09-30,2021-03-29,7days,BA,Y,월요일,주중,03,546
891,Gucci,vintage web cross bag brown,a1151303,2021-03-29,2021-03-29,7days,BA,N,월요일,주중,03,0
892,Balenciaga,ville logo bag green,a1150992,2021-03-27,2021-03-29,4days,BA,Y,월요일,주중,03,2
893,Gucci,microssima emily mini bag black,a1151297,2021-03-29,2021-03-29,4days,BA,Y,월요일,주중,03,0
894,Sandro,gather basic pattern A-Line tulle-dress nude,a1148878,2021-03-10,2021-03-29,4days,D,Y,월요일,주중,03,19
895,& Other Stories,flower pattern A-Line dress ivory,a1148878,2021-03-10,2021-03-29,4days,D,Y,월요일,주중,03,19
896,Gucci,mammont chain wallet bag black,a1151023,2021-03-27,2021-03-29,7days,BA,N,월요일,주중,03,2
897,Chanel,quilted shoulder bag black,a1151163,2021-03-28,2021-03-29,7days,BA,Y,월요일,주중,03,1
898,El estilo de Claire,lace flower pattern H-Line dress green,a1150975,2021-03-26,2021-03-29,7days,D,Y,월요일,주중,03,3
899,Celine,Luggage pink bag,a1150941,2021-03-26,2021-03-29,7days,BA,Y,월요일,주중,03,3
900,Polo Ralph Lauren,paisley print pattern skirt,a171071,2020-01-06,2021-03-29,4days,B,Y,월요일,주중,03,448
901,Gucci,sylvie leather mini chain bag black,a1100887,2020-05-19,2021-03-29,7days,BA,Y,월요일,주중,03,314
902,Sisley,lace flower pattern A-Line dress ivory,a1132877,2020-11-24,2021-03-29,4days,D,Y,월요일,주중,03,125
903,Max Mara,pocket check pattern singlebreasted-jacket brown,a1146721,2021-02-17,2021-03-29,4days,O,Y,월요일,주중,03,40
904,Mine,basic pattern t-shirts ivory,a1146721,2021-02-17,2021-03-29,4days,T,Y,월요일,주중,03,40
905,At Corner,pocket check pattern slacks charcoal,a1146721,2021-02-17,2021-03-29,4days,B,Y,월요일,주중,03,40
906,Saint Laurent,mini sunset chain bag black,a1151078,2021-03-27,2021-03-29,7days,BA,Y,월요일,주중,03,2
907,Louis Vuitton,favorite MM shoulder bag,a1151129,2021-03-28,2021-03-29,7days,BA,Y,월요일,주중,03,1
908,Essentiel Antwerp,button leopard print pattern singlebreasted-jacket beige,a1150732,2021-03-24,2021-03-28,4days,O,Y,일요일,휴일,03,4
909,Gucci,GG pattern boston bag beige,a1144107,2021-01-22,2021-03-28,4days,BA,Y,일요일,휴일,03,65
910,Cos,basic pattern A-Line dress black,a1151182,2021-03-28,2021-03-28,4days,D,Y,일요일,휴일,03,0
911,Theory,button basic pattern jacket black,a1151176,2021-03-28,2021-03-28,4days,O,Y,일요일,휴일,03,0
912,Gucci,GG pattern cross body bag beige,a1151175,2021-03-28,2021-03-28,7days,BA,N,일요일,휴일,03,0
913,Saint Laurent,chevron quilted cross bag black,a1151152,2021-03-28,2021-03-28,7days,BA,Y,일요일,휴일,03,0
914,Chloe,daria tote bag brown,a187913,2020-03-11,2021-03-28,7days,BA,Y,일요일,휴일,03,382
915,Gucci,flap cross bag grey,a1120886,2020-09-22,2021-03-28,7days,BA,Y,일요일,휴일,03,187
916,Burberry,belt basic pattern trench-coat beige,a163697,2019-12-12,2021-03-28,7days,O,Y,일요일,휴일,03,472
917,Louis Vuitton,thames hobo shoulder bag brown,a1150260,2021-03-21,2021-03-28,7days,BA,Y,일요일,휴일,03,7
918,Chanel,boy chanel clutch black,a1151134,2021-03-28,2021-03-28,7days,BA,Y,일요일,휴일,03,0
919,Gucci,button flower pattern H-Line dress lavender,a1150958,2021-03-26,2021-03-28,7days,D,N,일요일,휴일,03,2
920,Lookast,button flower pattern A-Line dress red,a1149257,2021-03-13,2021-03-28,7days,D,Y,일요일,휴일,03,15
921,Gucci,mamont chain bag black,a1147267,2021-02-23,2021-03-28,7days,BA,Y,일요일,휴일,03,33
922,Burberry London,double button two tone trench coat,a185174,2020-02-28,2021-03-28,4days,O,Y,일요일,휴일,03,394
923,Fendi,lettering pattern sweat-shirts grey,a185174,2020-02-28,2021-03-28,4days,T,Y,일요일,휴일,03,394
924,Chanel,small logo quilted cross body bag black,a1151058,2021-03-27,2021-03-28,7days,BA,Y,일요일,휴일,03,1
925,It michaa,tweed belt set dress,a1150287,2021-03-22,2021-03-27,7days,D,Y,토요일,휴일,03,5
926,Gucci,padlock GG canvas shoulder bag,a1151004,2021-03-27,2021-03-27,4days,BA,Y,토요일,휴일,03,0
927,Mixed,shoulder button pullover & burnout flare skirt,a1150959,2021-03-26,2021-03-26,4days,TP,N,금요일,주중,03,0
928,Celine,monogram cross body bag brown,a121532,2019-05-02,2021-03-26,7days,BA,Y,금요일,주중,03,694
929,Burberry,python cross body bag black,a1150957,2021-03-26,2021-03-26,7days,BA,Y,금요일,주중,03,0
930,Yves Saint Laurent,kate small monogram bag beige,a1142920,2021-01-14,2021-03-26,7days,BA,Y,금요일,주중,03,71
931,Chanel,grand-shopping caviar black shoulder bag,a1150511,2021-03-23,2021-03-26,7days,BA,Y,금요일,주중,03,3
932,Saint Laurent,lou cross bag black,a1150737,2021-03-25,2021-03-26,7days,BA,Y,금요일,주중,03,1
